{
  "$schema": "https://json-schema.org/draft/2020-12/schema",
  "$id": "https://writ.dev/spec/identifiers.schema.json",
  "title": "Writ identifiers, references, and repo registry (v1)",
  "description": "Workspace-global object identifiers, repo designators, references, and workspace repo registry entries. Normative text: spec/identifiers.md. Cross-field invariants the schema cannot express (resolution algorithm, registry uniqueness, opaque-fallback handling) are defined in the spec text and enforced by validators alongside this schema. additionalProperties is deliberately never false: unknown fields are preserved and ignored.",
  "type": "object",
  "properties": {
    "reference": { "$ref": "#/$defs/reference" },
    "context": { "$ref": "#/$defs/resolution-context" },
    "registry": {
      "type": "array",
      "items": { "$ref": "#/$defs/repo-entry" }
    },
    "expected": { "$ref": "#/$defs/resolution-expected" }
  },
  "required": ["reference"],
  "$defs": {
    "person-id": {
      "type": "string",
      "minLength": 3,
      "maxLength": 353,
      "pattern": "^[a-z][a-z0-9+.-]{0,31}:[\\s\\S]{1,320}$",
      "description": "Person identifier: scheme \":\" value, split on the FIRST colon (an email value may carry a colon in a quoted local part), per spec/identifiers.md. The scheme matches [a-z][a-z0-9+.-]* and is at most 32 characters; the value is 1 to 320 code points. There is no bare, colonless form and no implicit scheme. maxLength 353 is derived (32 + 1 + 320) and stated so a validator seeing only the flat string has a number. The bounds are a resource cap, not an RFC 5321 conformance check: Writ does not parse email addresses, and length is the only shape constraint applied to the value. Bounds are enforced by rejection, never truncation. The value bound applies to the normalized value, which producers MUST have written."
    },
    "object-id": {
      "type": "string",
      "pattern": "^[0-9a-f]{32}$",
      "description": "Canonical Writ-minted object ID: 128 bits of entropy as 32 lowercase hexadecimal characters."
    },
    "repo-id": {
      "type": "string",
      "pattern": "^[0-9a-f]{32}$",
      "description": "Writ repository designator: 32 lowercase hexadecimal characters minted at writ init."
    },
    "reference": {
      "type": "string",
      "minLength": 1,
      "maxLength": 513,
      "pattern": "^([0-9a-f]{32}#)?[^#\\s]+$",
      "description": "Reference string: optional 32-hex repo-id followed by #, followed by an object-id (canonical 32-hex or envelope-legal opaque ASCII without #)."
    },
    "canonical-reference": {
      "type": "string",
      "pattern": "^([0-9a-f]{32}#)?[0-9a-f]{32}$",
      "description": "Canonical reference: bare <object-id> (32 hex) or <repo-id>#<object-id> (32 hex # 32 hex)."
    },
    "repo-slug": {
      "type": "string",
      "minLength": 1,
      "pattern": "^[^\\s]+$",
      "description": "Repository slug in the registry: non-empty string without whitespace."
    },
    "remote-url": {
      "type": "string",
      "minLength": 1,
      "description": "Remote URL string for discovery: non-empty string."
    },
    "repo-entry": {
      "type": "object",
      "properties": {
        "repo_id": { "$ref": "#/$defs/repo-id" },
        "slug": { "$ref": "#/$defs/repo-slug" },
        "remotes": {
          "type": "array",
          "items": { "$ref": "#/$defs/remote-url" }
        },
        "is_workspace": {
          "type": "boolean"
        }
      },
      "required": ["repo_id", "slug"]
    },
    "resolution-context": {
      "type": "object",
      "properties": {
        "local_repo_id": { "$ref": "#/$defs/repo-id" }
      }
    },
    "resolution-expected": {
      "type": "object",
      "properties": {
        "resolved": { "type": "boolean" },
        "scope": {
          "type": "string",
          "enum": ["local", "cross-repo", "unresolved"]
        },
        "repo_id": { "$ref": "#/$defs/repo-id" },
        "object_id": { "type": "string", "minLength": 1 }
      },
      "required": ["resolved", "scope", "object_id"]
    }
  }
}
