{
  "reference": "00000000000000000000000000000001#0123456789abcdef0123456789abcdef",
  "context": {
    "local_repo_id": "a1b2c3d4e5f60718293a4b5c6d7e8f90"
  },
  "registry": [
    {
      "repo_id": "00000000000000000000000000000001",
      "slug": "acme/workspace",
      "remotes": ["git@github.com:acme/workspace.git"],
      "is_workspace": true
    }
  ],
  "expected": {
    "resolved": true,
    "scope": "cross-repo",
    "repo_id": "00000000000000000000000000000001",
    "object_id": "0123456789abcdef0123456789abcdef"
  }
}
